{
  "schema_version": "1.0",
  "suite_id": "suite:konstellation-explorer-fr-3-prototype",
  "language": "fr",
  "capability_profile": "konstellation-explorer-3",
  "runtime_set_id": "konstellation-fr-3",
  "cases": [
    {
      "case_id": "A001-core",
      "request": {
        "schema_version": "1.0",
        "request_id": "sha256:bb6ced3288e21f59be4470c0c78c98caf7c3eb24e8553079531405ef06ddfdac",
        "semantic_graph": {
          "graph_id": "g:A001-core",
          "nodes": [
            {
              "id": "n_agent",
              "kind": "entity_ref",
              "external_ref": "theophile:augustin"
            },
            {
              "id": "n_patient",
              "kind": "entity_ref",
              "external_ref": "theophile:existence-libre-arbitre"
            }
          ],
          "statements": [
            {
              "id": "s1",
              "predicate_ref": "theophile:defendre",
              "arguments": [
                {
                  "role_ref": "role:agent",
                  "value_id": "n_agent"
                },
                {
                  "role_ref": "role:patient",
                  "value_id": "n_patient"
                }
              ],
              "polarity": "positive",
              "source_refs": [
                "theophile-source:aug_grace#Chapitres 2–4"
              ]
            }
          ]
        },
        "obligations": [
          {
            "obligation_id": "o1",
            "semantic_refs": [
              "s1"
            ],
            "force": "PRESENT",
            "ordering": "FIXED",
            "source_refs": [
              "theophile-source:aug_grace#Chapitres 2–4"
            ]
          }
        ],
        "supporting_context": [],
        "context": {
          "target_language": "fr",
          "target_locale": "fr-CA",
          "channel": "offline-build",
          "register": "encyclopedic"
        },
        "constraints": {
          "allowed_block_kinds": [
            "utterance"
          ],
          "opening_policy": "forbidden",
          "closing_policy": "forbidden",
          "list_policy": "forbidden",
          "output_format": "structured"
        },
        "capability_profile": "konstellation-explorer-3",
        "runtime_selector": {
          "runtime_set_id": "konstellation-fr-3"
        }
      },
      "expected": {
        "plain_text": "Augustin défend l’existence du libre arbitre.",
        "coverage_complete": true
      }
    },
    {
      "case_id": "H131-second-clause",
      "request": {
        "schema_version": "1.0",
        "request_id": "sha256:13508c21b4c6e6e0c19681311e0ff5c965174eb4b5b27914479da526bcd0a2fc",
        "semantic_graph": {
          "graph_id": "g:H131-second-clause",
          "nodes": [
            {
              "id": "n_agent",
              "kind": "entity_ref",
              "external_ref": "theophile:foi"
            },
            {
              "id": "n_patient",
              "kind": "entity_ref",
              "external_ref": "theophile:enquete-intellectuelle-anselme"
            }
          ],
          "statements": [
            {
              "id": "s1",
              "predicate_ref": "theophile:stimuler",
              "arguments": [
                {
                  "role_ref": "role:agent",
                  "value_id": "n_agent"
                },
                {
                  "role_ref": "role:patient",
                  "value_id": "n_patient"
                }
              ],
              "polarity": "positive",
              "source_refs": [
                "theophile-source:anselm#Proslogion, ch.1"
              ]
            }
          ]
        },
        "obligations": [
          {
            "obligation_id": "o1",
            "semantic_refs": [
              "s1"
            ],
            "force": "PRESENT",
            "ordering": "FIXED",
            "source_refs": [
              "theophile-source:anselm#Proslogion, ch.1"
            ]
          }
        ],
        "supporting_context": [],
        "context": {
          "target_language": "fr",
          "target_locale": "fr-CA",
          "channel": "offline-build",
          "register": "encyclopedic"
        },
        "constraints": {
          "allowed_block_kinds": [
            "utterance"
          ],
          "opening_policy": "forbidden",
          "closing_policy": "forbidden",
          "list_policy": "forbidden",
          "output_format": "structured"
        },
        "capability_profile": "konstellation-explorer-3",
        "runtime_selector": {
          "runtime_set_id": "konstellation-fr-3"
        }
      },
      "expected": {
        "plain_text": "La foi stimule l’enquête intellectuelle d’Anselme.",
        "coverage_complete": true
      }
    },
    {
      "case_id": "H223-core",
      "request": {
        "schema_version": "1.0",
        "request_id": "sha256:37748d271c5281979eaa6bce404542566507a5eb917746033d5a23e0bfe5a2bb",
        "semantic_graph": {
          "graph_id": "g:H223-core",
          "nodes": [
            {
              "id": "n_agent",
              "kind": "entity_ref",
              "external_ref": "theophile:leon-xiii"
            },
            {
              "id": "n_patient",
              "kind": "entity_ref",
              "external_ref": "theophile:propriete-privee-prevoyance-famille"
            }
          ],
          "statements": [
            {
              "id": "s1",
              "predicate_ref": "theophile:defendre",
              "arguments": [
                {
                  "role_ref": "role:agent",
                  "value_id": "n_agent"
                },
                {
                  "role_ref": "role:patient",
                  "value_id": "n_patient"
                }
              ],
              "polarity": "positive",
              "source_refs": [
                "theophile-source:rn#Rerum novarum, développement sur la propriété et la famille"
              ]
            }
          ]
        },
        "obligations": [
          {
            "obligation_id": "o1",
            "semantic_refs": [
              "s1"
            ],
            "force": "PRESENT",
            "ordering": "FIXED",
            "source_refs": [
              "theophile-source:rn#Rerum novarum, développement sur la propriété et la famille"
            ]
          }
        ],
        "supporting_context": [],
        "context": {
          "target_language": "fr",
          "target_locale": "fr-CA",
          "channel": "offline-build",
          "register": "encyclopedic"
        },
        "constraints": {
          "allowed_block_kinds": [
            "utterance"
          ],
          "opening_policy": "forbidden",
          "closing_policy": "forbidden",
          "list_policy": "forbidden",
          "output_format": "structured"
        },
        "capability_profile": "konstellation-explorer-3",
        "runtime_selector": {
          "runtime_set_id": "konstellation-fr-3"
        }
      },
      "expected": {
        "plain_text": "Léon XIII défend la propriété privée comme moyen de prévoyance et de protection de la famille.",
        "coverage_complete": true
      }
    },
    {
      "case_id": "K003-classification",
      "request": {
        "schema_version": "1.0",
        "request_id": "sha256:7b66811c258bfbcb132678cebf31347d695c39cffa344636345b4f2a540d064c",
        "semantic_graph": {
          "graph_id": "g:K003-classification",
          "nodes": [
            {
              "id": "n_entity",
              "kind": "entity_ref",
              "external_ref": "theophile:immaculee-conception"
            },
            {
              "id": "n_class",
              "kind": "entity_ref",
              "external_ref": "theophile:dogme"
            }
          ],
          "statements": [
            {
              "id": "s1",
              "predicate_ref": "theophile:classified-as",
              "arguments": [
                {
                  "role_ref": "role:entity",
                  "value_id": "n_entity"
                },
                {
                  "role_ref": "role:class",
                  "value_id": "n_class"
                }
              ],
              "polarity": "positive",
              "source_refs": [
                "theophile-source:ccc_mary#CEC 491 ; citation de la définition de 1854"
              ]
            }
          ]
        },
        "obligations": [
          {
            "obligation_id": "o1",
            "semantic_refs": [
              "s1"
            ],
            "force": "PRESENT",
            "ordering": "FIXED",
            "source_refs": [
              "theophile-source:ccc_mary#CEC 491 ; citation de la définition de 1854"
            ]
          }
        ],
        "supporting_context": [],
        "context": {
          "target_language": "fr",
          "target_locale": "fr-CA",
          "channel": "offline-build",
          "register": "encyclopedic"
        },
        "constraints": {
          "allowed_block_kinds": [
            "utterance"
          ],
          "opening_policy": "forbidden",
          "closing_policy": "forbidden",
          "list_policy": "forbidden",
          "output_format": "structured"
        },
        "capability_profile": "konstellation-explorer-3",
        "runtime_selector": {
          "runtime_set_id": "konstellation-fr-3"
        }
      },
      "expected": {
        "plain_text": "L’Immaculée Conception est un dogme.",
        "coverage_complete": true
      }
    },
    {
      "case_id": "P014-core",
      "request": {
        "schema_version": "1.0",
        "request_id": "sha256:962baa4c2c960d176739712b36e5950495deccc8629869d91e243a24a2f2eee0",
        "semantic_graph": {
          "graph_id": "g:P014-core",
          "nodes": [
            {
              "id": "n_agent",
              "kind": "entity_ref",
              "external_ref": "theophile:jean-paul-ii"